{
  "repository_id": "5d1f5c1e-7f43-4c6a-9a51-0d6a1c1b2015",
  "project_id": "5d1f5c1e-7f43-4c6a-9a51-0d6a1c1b2012",
  "local_key": "3f1c0b5f9a2e4d7c8b6a1e5f0c9d3a7b2e6f4c8d1a5b9e3f7c2d6a0b4e8f1c5d",
  "branch": "mootbox/checkout-to-orders-api",
  "head_sha": "89abcdef0123456789abcdef0123456789abcdef",
  "dirty": false
}
